{"cert_sha256":"sha256:27c1089f28a4673d4b348344f82850b65b4d8ef220dae9277b210df3a4dc09c0","compile_command_args":{"cap_in":40,"deductible_in":5,"hodl_lower_in":30,"hodl_upper_in":80,"lpv_lower_in":10,"lpv_upper_in":60,"n_in":2},"compile_command_tag":"compile_lp_loss_cover","compiled_artifact_lower":0,"compiled_artifact_upper":80,"compiled_effects":{"compiled_upper":80,"firev_accept":false,"payoff_out":0},"compiled_state":{"artifact_lower":0,"artifact_upper":80,"cap_amount":40,"deductible":5,"hodl_lower":30,"hodl_upper":80,"holder_delta":0,"holder_posted":0,"lpv_lower":10,"lpv_upper":60,"n_notional":2,"phase":"Compiled","witness_hodl_final":0,"witness_lpv_final":0,"writer_delta":0,"writer_posted":0},"instance_hash":"sha256:194cf1e01b8ffe5016dc4404a2b9b466024a371921e1e0c9fefd05dd376a6d1b","ir_hash":"sha256:bf1509a7c86dfd9cd2d353133de9abf879f2fdf2279c4bd3114636233e8e7be4","kernel_ir_hash":"sha256:bf1509a7c86dfd9cd2d353133de9abf879f2fdf2279c4bd3114636233e8e7be4","kernel_model_id":"fire_lp_loss_cover_v1","kernel_receipt_sha256":"sha256:72df1c208091bbd96575c35ce64d3989bee3ea5b83468c4a596366d2c79f01cd","object_family":"capped_lp_loss_cover","object_hash":"sha256:10bfe51a55b6821ca73855e541b79f1e11a2f916cd1e75a5fbea72f8903a911b","object_id":"lp_loss_cover_v1","object_name":"LPLossCover","object_version":"v1","schema":"zenodex/fire-kernel-eval-receipt/v1"}